{
  "$schema": "http://json-schema.org/draft-07/schema#",
  "$id": "https://swiss-delivery-tracker/packages/carriers/core/catalog/carrier.schema.json",
  "title": "Carrier",
  "description": "One carrier folder's carrier.json: the single source of truth for that carrier. scripts/generate-api-contract.mjs merges every carriers/*/carrier.json into contracts/openapi.json under x-carriers and regenerates the TypeScript, Swift and package catalogs from it.",
  "type": "object",
  "additionalProperties": false,
  "required": [
    "id",
    "displayName",
    "aliases",
    "region",
    "brand",
    "selectable",
    "timezone",
    "tracking",
    "capabilities",
    "portal",
    "links",
    "detection"
  ],
  "properties": {
    "id": {
      "description": "Carrier id; must equal the folder name and appears in CarrierId.",
      "type": "string",
      "pattern": "^[a-z0-9]+(?:-[a-z0-9]+)*$"
    },
    "displayName": {
      "description": "Default (English) carrier name.",
      "type": "string",
      "minLength": 1
    },
    "displayNames": {
      "description": "Localized names, keyed by locale. Only carriers whose name is translated define this.",
      "type": "object",
      "minProperties": 1,
      "propertyNames": {
        "pattern": "^[a-z]{2}(?:-[A-Za-z0-9]+)*$"
      },
      "additionalProperties": {
        "type": "string",
        "minLength": 1
      }
    },
    "aliases": {
      "description": "Other names the carrier is known by. The carrier pickers search them.",
      "type": "array",
      "items": {
        "type": "string",
        "minLength": 1
      },
      "uniqueItems": true
    },
    "region": {
      "description": "Where the carrier delivers under its own name, home country first. The carrier pickers show and search these countries. Empty for networks without a home market (UPS, FedEx) and for platforms.",
      "type": "object",
      "additionalProperties": false,
      "required": [
        "countries"
      ],
      "properties": {
        "countries": {
          "description": "ISO 3166-1 alpha-2 country codes.",
          "type": "array",
          "items": {
            "type": "string",
            "pattern": "^[A-Z]{2}$"
          },
          "uniqueItems": true
        }
      }
    },
    "brand": {
      "description": "The carrier's public color.",
      "type": "object",
      "additionalProperties": false,
      "required": [
        "color"
      ],
      "properties": {
        "color": {
          "description": "Accent color used by the web and native clients.",
          "$ref": "#/definitions/brandColor"
        }
      }
    },
    "selectable": {
      "description": "Whether the carrier appears in the manual carrier picker.",
      "type": "boolean"
    },
    "timezone": {
      "description": "IANA timezone used when the carrier reports local timestamps without an offset.",
      "type": "string",
      "minLength": 1
    },
    "tracking": {
      "type": "object",
      "additionalProperties": false,
      "required": [
        "mode",
        "adapter",
        "steps"
      ],
      "properties": {
        "mode": {
          "description": "automatic: we fetch tracking ourselves. link-only: we can only link to the portal.",
          "enum": [
            "automatic",
            "link-only"
          ]
        },
        "adapter": {
          "description": "\"universal\", the id of a carrier folder that has adapter.ts (its own, or the folder whose adapter serves it), or null for link-only carriers.",
          "type": [
            "string",
            "null"
          ],
          "minLength": 1
        },
        "upstreamName": {
          "description": "Carrier name as the serving adapter's upstream service spells it, when it differs from displayName.",
          "type": "string",
          "minLength": 1
        },
        "requirements": {
          "description": "Extra inputs the forms collect besides the tracking number. Each is required unless it is marked optional.",
          "type": "array",
          "minItems": 1,
          "items": {
            "$ref": "#/definitions/requirement"
          }
        },
        "steps": {
          "description": "Ordered runner steps. Reserved for the runner phase; empty means the adapter still owns its own flow.",
          "type": "array",
          "items": {
            "type": "string",
            "minLength": 1
          }
        },
        "recognition": {
          "description": "Present when the adapter implements recognize(): a cheap check, without the user's inputs, of whether the carrier knows a number (plain HTTP, a clean not-found, no browser). Ambiguous numbers ask these carriers. rank orders them by how common they are for the app's users, highest first; no two carriers share a rank.",
          "type": "object",
          "additionalProperties": false,
          "required": [
            "rank"
          ],
          "properties": {
            "rank": {
              "type": "integer",
              "minimum": 1,
              "maximum": 1000
            },
            "pattern": {
              "description": "Regular expression for the normalized numbers recognize() can answer. Recognition is only asked about those; a number another rule offers stays a suggestion. Absent: every number the carrier's rules offer.",
              "type": "string",
              "minLength": 1
            },
            "servedCountriesOnly": {
              "description": "Recognition asks the carrier only when the caller's country hint is one of its countries: its numbers are bare runs that carriers elsewhere print too. Absent: asked whatever the hint.",
              "const": true
            }
          }
        },
        "refresh": {
          "type": "object",
          "properties": {
            "minMinutes": {
              "type": "integer",
              "minimum": 1
            },
            "afterFailureMinutes": {
              "type": "integer",
              "minimum": 1
            }
          },
          "required": [
            "minMinutes"
          ],
          "additionalProperties": false
        },
        "localClocks": {
          "description": "True when the adapter can return scans without an instant: a wall clock with no UTC offset, or provider text. Consumers can keep that history beside instants and ask fallback providers for dated scans.",
          "type": "boolean"
        },
        "dateOnlyScans": {
          "description": "True when every scan the adapter dates by its day alone is one the carrier gives no clock by design, such as a delivery round or a history listed under day headings. Fallback providers have no clock to add to such a scan.",
          "const": true
        },
        "browser": {
          "description": "True when a lookup through the adapter can open a browser: the private browser service or a local or remote Chromium. Consumers can space out repeated lookups.",
          "const": true
        },
        "browserRecognition": {
          "description": "Present when the adapter implements recognizeWithBrowser(): opt-in browser confirmation without recipient inputs, requiring dated shipment activity. Higher rank is asked first after HTTP checks are inconclusive; no two carriers share a browser rank.",
          "type": "object",
          "additionalProperties": false,
          "required": [
            "rank"
          ],
          "properties": {
            "rank": {
              "type": "integer",
              "minimum": 1,
              "maximum": 1000
            }
          }
        }
      }
    },
    "capabilities": {
      "description": "Declared capability flags. Reserved for a later phase.",
      "type": "array",
      "items": {
        "type": "string",
        "minLength": 1
      },
      "uniqueItems": true
    },
    "portal": {
      "description": "Facts about the carrier's public tracking portal.",
      "type": "object",
      "additionalProperties": false,
      "required": [
        "shows",
        "scraped",
        "discarded",
        "unavailable"
      ],
      "properties": {
        "url": {
          "description": "Public tracking URL template containing {trackingNumber}.",
          "type": "string"
        },
        "searchUrl": {
          "description": "Public page, with no number in it, where a visitor on a phone types a tracking number. Linked when the number is hidden. Left out when the carrier has no such page.",
          "type": "string",
          "pattern": "^https://[^\\s{}]+$"
        },
        "helpUrl": {
          "description": "The carrier's official page where someone receiving a parcel gets help or reaches its customer service. Linked when a parcel stops moving. Left out when the carrier has no such page.",
          "type": "string",
          "pattern": "^https://[^\\s{}]+$"
        },
        "hidesDestinationLeg": {
          "description": "Regular expression: numbers whose journey in the destination country the portal does not show, as it names no carrier there. Linked readers are told so when such a parcel stops moving.",
          "type": "string",
          "minLength": 1
        },
        "siteName": {
          "description": "Name of the site the portal URL points at, when it is not the carrier itself.",
          "type": "string",
          "minLength": 1
        },
        "canaryUrl": {
          "description": "Public, credential-free HTTPS URL the weekly canary probes. Required for automatic carriers.",
          "type": "string"
        },
        "shows": {
          "description": "Fields the portal displays. Reserved for a later documentation phase.",
          "type": "array",
          "items": {
            "type": "string",
            "minLength": 1
          }
        },
        "scraped": {
          "description": "Fields we retain. Reserved for a later documentation phase.",
          "type": "array",
          "items": {
            "type": "string",
            "minLength": 1
          }
        },
        "discarded": {
          "description": "Fields the portal shows that we deliberately drop. Reserved for a later documentation phase.",
          "type": "array",
          "items": {
            "type": "string",
            "minLength": 1
          }
        },
        "unavailable": {
          "description": "Fields the portal does not expose. Reserved for a later documentation phase.",
          "type": "array",
          "items": {
            "type": "string",
            "minLength": 1
          }
        }
      }
    },
    "links": {
      "description": "Rules that recognize a carrier tracking link pasted by the user.",
      "type": "array",
      "items": {
        "$ref": "#/definitions/linkRule"
      }
    },
    "detection": {
      "description": "Rules that recognize a tracking number. Exactly one high-confidence match selects the carrier.",
      "type": "array",
      "items": {
        "$ref": "#/definitions/detectionRule"
      }
    }
  },
  "definitions": {
    "brandColor": {
      "type": "string",
      "pattern": "^#[0-9a-fA-F]{6}$"
    },
    "requirement": {
      "type": "object",
      "additionalProperties": false,
      "required": [
        "field",
        "validator",
        "label",
        "type"
      ],
      "properties": {
        "field": {
          "description": "Input name. The generator checks that the validator is one this input accepts.",
          "enum": [
            "trackingUrl",
            "postcode"
          ]
        },
        "validator": {
          "type": "string",
          "minLength": 1
        },
        "whenTrackingNumber": {
          "description": "Regular expression: the input is only asked for and validated for matching tracking numbers.",
          "type": "string",
          "minLength": 1
        },
        "optional": {
          "description": "The user may leave the input blank: the adapter tracks without it and uses it only to unlock extra detail. A value that is supplied is still validated.",
          "type": "boolean"
        },
        "showsMore": {
          "description": "With optional: the carrier shows more of the parcel with the input, whatever else answers, so a parcel saved without it is worth asking for it. Left out where the carrier needs it for only some parcels of the shape and asks for those.",
          "const": true
        },
        "readsCountry": {
          "description": "With a postcode: the lookup reads the country the postcode is from (postcodeCountry), so it is worth naming beside the postcode. Left out where the carrier reads the postcode alone.",
          "const": true
        },
        "label": {
          "type": "string",
          "minLength": 1
        },
        "type": {
          "enum": [
            "text",
            "url"
          ]
        },
        "placeholder": {
          "type": "string"
        },
        "help": {
          "type": "string"
        },
        "pattern": {
          "type": "string",
          "minLength": 1
        },
        "maxLength": {
          "type": "integer",
          "minimum": 1
        },
        "inputMode": {
          "enum": [
            "text",
            "numeric"
          ]
        },
        "autoComplete": {
          "type": "string",
          "minLength": 1
        }
      }
    },
    "linkRule": {
      "type": "object",
      "additionalProperties": false,
      "required": [
        "domains"
      ],
      "properties": {
        "domains": {
          "type": "array",
          "minItems": 1,
          "items": {
            "type": "string",
            "minLength": 1
          }
        },
        "path": {
          "type": "string",
          "minLength": 1
        },
        "pathPattern": {
          "type": "string",
          "minLength": 1
        },
        "params": {
          "type": "array",
          "minItems": 1,
          "items": {
            "type": "string",
            "minLength": 1
          }
        },
        "fragment": {
          "type": "string",
          "minLength": 1
        },
        "query": {
          "type": "string",
          "minLength": 1
        },
        "keepsCapabilityUrl": {
          "type": "boolean"
        },
        "detectFromNumber": {
          "type": "boolean"
        },
        "ownNumbersOnly": {
          "type": "boolean"
        }
      }
    },
    "detectionRule": {
      "type": "object",
      "additionalProperties": false,
      "required": [
        "id",
        "pattern",
        "confidence"
      ],
      "properties": {
        "id": {
          "description": "Stable rule id, unique across the catalog; the sweep, the collision file and checksumRejections refer to it.",
          "type": "string",
          "pattern": "^[a-z0-9]+(?:-[a-z0-9]+)*$"
        },
        "pattern": {
          "type": "string",
          "minLength": 1
        },
        "rawPattern": {
          "type": "string",
          "minLength": 1
        },
        "confidence": {
          "enum": [
            "high",
            "low"
          ]
        },
        "checksum": {
          "enum": [
            "s10",
            "mondial-relay",
            "hermes",
            "gls",
            "dhl-express",
            "tnt",
            "poczta-polska",
            "correos-spain",
            "dpd",
            "usps",
            "sscc",
            "ups",
            "colissimo",
            "ukrposhta",
            "evri",
            "mod7",
            "gs1",
            "ontrac",
            "luhn",
            "fedex",
            "sf-express",
            "fedex-ground-96",
            "fedex-1d",
            "identcode",
            "fedex-ground-economy",
            "pos-laju",
            "saia",
            "magyar-posta",
            "poste-italiane",
            "frankier-id",
            "dhl-ecommerce-pl"
          ]
        },
        "preferred": {
          "description": "Low-confidence rules only: the number shape is evidence for this carrier (such as a depot range), so it is listed first among the suggestions. It never selects the carrier on its own.",
          "const": true
        }
      }
    }
  }
}
