{
  "id": "ctt-express",
  "displayName": "CTT Express",
  "aliases": [
    "CTT Express Tracking"
  ],
  "region": {
    "countries": [
      "ES",
      "PT"
    ]
  },
  "brand": {
    "color": "#df0024"
  },
  "selectable": true,
  "timezone": "UTC",
  "tracking": {
    "mode": "automatic",
    "adapter": "ctt-express",
    "steps": [
      "direct",
      "retry"
    ],
    "recognition": {
      "rank": 790
    },
    "localClocks": true
  },
  "capabilities": [
    "history",
    "eta",
    "weight",
    "delivery_partner",
    "delivery_tracking_number"
  ],
  "portal": {
    "url": "https://shipping-tracking.production.cloud2.cttexpress.com/?sc={trackingNumber}",
    "searchUrl": "https://shipping-tracking.production.cloud2.cttexpress.com/",
    "helpUrl": "https://www.cttexpress.com/envios/incidencias",
    "canaryUrl": "https://shipping-tracking.production.cloud2.cttexpress.com/",
    "shows": [
      "status",
      "history",
      "estimated_delivery"
    ],
    "scraped": [
      "status",
      "history",
      "estimated_delivery",
      "weight",
      "delivery_partner"
    ],
    "discarded": [],
    "unavailable": []
  },
  "links": [
    {
      "domains": [
        "shipping-tracking.production.cloud2.cttexpress.com"
      ],
      "params": [
        "sc"
      ]
    }
  ],
  "detection": [
    {
      "id": "ctt-express-3",
      "pattern": "^00001000\\d{14}$",
      "confidence": "low"
    },
    {
      "id": "ctt-express-1",
      "pattern": "^00\\d{4}00\\d{14}$",
      "confidence": "high"
    },
    {
      "id": "ctt-express-2",
      "pattern": "^00\\d{4}00\\d{14}001$",
      "confidence": "high"
    }
  ]
}
