{
  "id": "inpost",
  "displayName": "InPost",
  "aliases": [
    "InPost Paczkomaty",
    "Paczkomaty",
    "InPost Easy",
    "InPost UK",
    "Yodel"
  ],
  "region": {
    "countries": [
      "PL",
      "IT",
      "PT",
      "GB"
    ]
  },
  "brand": {
    "color": "#ffcc05"
  },
  "selectable": true,
  "timezone": "UTC",
  "tracking": {
    "mode": "automatic",
    "adapter": "inpost",
    "steps": [
      "direct",
      "shipx"
    ],
    "recognition": {
      "rank": 820
    }
  },
  "capabilities": [
    "history",
    "location",
    "delivered_at",
    "pickup_point"
  ],
  "portal": {
    "url": "https://inpost.pl/sledzenie-przesylek?number={trackingNumber}",
    "searchUrl": "https://inpost.pl/sledzenie-przesylek",
    "helpUrl": "https://inpost.pl/kontakt",
    "canaryUrl": "https://inposteasy.com/",
    "shows": [
      "status",
      "history",
      "location",
      "destination_country",
      "pickup_point"
    ],
    "scraped": [
      "status",
      "history",
      "location",
      "delivered_at",
      "destination_country",
      "pickup_point"
    ],
    "discarded": [
      "origin_country"
    ],
    "unavailable": []
  },
  "links": [
    {
      "domains": [
        "inpost.pl"
      ],
      "pathPattern": "^/(?:en/find-parcel|sledzenie-przesylek)/?$",
      "params": [
        "number"
      ]
    }
  ],
  "detection": [
    {
      "id": "inpost-answered-prefix",
      "pattern": "^(?:20|52|6[2-6]|8[02])\\d{22}$",
      "confidence": "low",
      "preferred": true
    },
    {
      "id": "inpost-1",
      "pattern": "^\\d{24}$",
      "confidence": "low"
    },
    {
      "id": "inpost-2",
      "pattern": "^JJD\\d{16}$",
      "confidence": "low",
      "preferred": true
    },
    {
      "id": "inpost-3",
      "pattern": "^JD\\d{16}$",
      "confidence": "low"
    },
    {
      "id": "inpost-4",
      "pattern": "^8YDR\\d{9}$",
      "confidence": "high"
    },
    {
      "id": "inpost-5",
      "pattern": "^\\d{2}[A-Z]{3}\\d{7}A\\d{3}$",
      "confidence": "low"
    }
  ]
}
