{
  "id": "canada-post",
  "displayName": "Canada Post",
  "aliases": [],
  "region": {
    "countries": [
      "CA"
    ]
  },
  "brand": {
    "color": "#e4002b"
  },
  "selectable": true,
  "timezone": "UTC",
  "tracking": {
    "mode": "automatic",
    "adapter": "canada-post",
    "steps": [
      "direct"
    ],
    "recognition": {
      "rank": 590
    },
    "localClocks": true
  },
  "capabilities": [
    "history",
    "location",
    "eta",
    "delivered_at",
    "sender_name",
    "service_name"
  ],
  "portal": {
    "url": "https://www.canadapost-postescanada.ca/track-reperage/en/search?searchFor={trackingNumber}",
    "searchUrl": "https://www.canadapost-postescanada.ca/track-reperage/en/search",
    "helpUrl": "https://www.canadapost-postescanada.ca/cpc/en/support/kb/tracking/tracking-status-not-updating.page",
    "canaryUrl": "https://www.canadapost-postescanada.ca/track-reperage/en/home",
    "shows": [
      "status",
      "history",
      "eta",
      "eta_window",
      "location",
      "delivered_at",
      "sender_name",
      "service_name"
    ],
    "scraped": [
      "status",
      "history",
      "eta",
      "eta_window",
      "location",
      "delivered_at",
      "sender_name",
      "service_name"
    ],
    "discarded": [
      "delivery options",
      "recipient details",
      "postal addresses",
      "signatures",
      "delivery images"
    ],
    "unavailable": []
  },
  "links": [
    {
      "domains": [
        "canadapost-postescanada.ca",
        "canadapost.ca"
      ],
      "params": [
        "searchFor"
      ]
    }
  ],
  "detection": [
    {
      "id": "canada-post-1",
      "pattern": "^\\d{16}$",
      "confidence": "low",
      "checksum": "gs1"
    },
    {
      "id": "canada-post-2",
      "pattern": "^[A-Z]{2}\\d{9}CA$",
      "confidence": "high",
      "checksum": "s10"
    }
  ]
}
