{
  "id": "tnt",
  "displayName": "TNT",
  "aliases": [],
  "region": {
    "countries": []
  },
  "brand": {
    "color": "#ff6600"
  },
  "selectable": true,
  "timezone": "Europe/Paris",
  "tracking": {
    "mode": "automatic",
    "adapter": "tnt",
    "steps": [
      "direct"
    ],
    "recognition": {
      "rank": 880
    }
  },
  "capabilities": [
    "history",
    "location",
    "eta",
    "destination_country",
    "provider_code"
  ],
  "portal": {
    "url": "https://www.tnt.com/express/en_gb/site/shipping-tools/tracking.html?searchType=con&cons={trackingNumber}",
    "searchUrl": "https://www.tnt.com/express/en_gb/site/shipping-tools/tracking.html",
    "helpUrl": "https://www.tnt.com/express/en_gb/site/support.html",
    "canaryUrl": "https://www.tnt.fr/public/suivi_colis/recherche/index.do",
    "shows": [
      "status",
      "history",
      "location",
      "eta",
      "destination_country",
      "customer_reference",
      "signature"
    ],
    "scraped": [
      "status",
      "history",
      "location",
      "eta",
      "destination_country",
      "provider_code"
    ],
    "discarded": [
      "customer_reference",
      "signature"
    ],
    "unavailable": []
  },
  "links": [
    {
      "domains": [
        "tnt.com"
      ],
      "pathPattern": "^/express/[a-z]{2}_[a-z]{2}/site/(?:shipping-tools/tracking|herramientas-envio/seguimiento|outils-expedition/suivi|strumenti-spedizione/tracking)\\.html$",
      "params": [
        "cons"
      ],
      "ownNumbersOnly": true
    }
  ],
  "detection": [
    {
      "id": "tnt-upu",
      "pattern": "^GE\\d{9}WW$",
      "confidence": "high",
      "checksum": "s10"
    },
    {
      "id": "tnt-1",
      "pattern": "^\\d{9}$",
      "confidence": "low",
      "checksum": "tnt",
      "preferred": true
    },
    {
      "id": "tnt-2",
      "pattern": "^\\d{16}$",
      "confidence": "low"
    }
  ]
}
