{
  "id": "slovenska-posta",
  "displayName": "Slovenská pošta",
  "aliases": [
    "Slovak Post",
    "Slovenska posta"
  ],
  "region": {
    "countries": [
      "SK"
    ]
  },
  "brand": {
    "color": "#f9bb00"
  },
  "selectable": true,
  "timezone": "Europe/Bratislava",
  "tracking": {
    "mode": "automatic",
    "adapter": "slovenska-posta",
    "steps": [
      "direct",
      "retry"
    ],
    "recognition": {
      "rank": 170
    },
    "localClocks": true
  },
  "capabilities": [
    "history",
    "location",
    "provider_code",
    "pickup_point",
    "weight",
    "delivered_at",
    "destination_country"
  ],
  "portal": {
    "url": "https://www.posta.sk/sledovanie-zasielok#parcel={trackingNumber}",
    "searchUrl": "https://www.posta.sk/sledovanie-zasielok",
    "helpUrl": "https://www.posta.sk/podpora/kontakty",
    "canaryUrl": "https://www.posta.sk/sledovanie-zasielok",
    "shows": [
      "status",
      "history",
      "location",
      "pickup_point",
      "pickup_point_address",
      "pickup_deadline",
      "weight",
      "destination_country",
      "origin_country",
      "service_name",
      "additional_services",
      "payment_details",
      "parcel_count",
      "payment_documents",
      "delivery_options"
    ],
    "scraped": [
      "status",
      "history",
      "location",
      "provider_code",
      "pickup_point",
      "weight",
      "delivered_at",
      "destination_country"
    ],
    "discarded": [
      "pickup_point_address",
      "pickup_deadline",
      "origin_country",
      "service_name",
      "additional_services",
      "payment_details",
      "parcel_count",
      "payment_documents",
      "delivery_options"
    ],
    "unavailable": [
      "offset_timestamps",
      "eta",
      "proof_of_delivery"
    ]
  },
  "links": [
    {
      "domains": [
        "posta.sk"
      ],
      "pathPattern": "^/sledovanie-zasielok/?$",
      "fragment": "(?:^|&)parcel=([^&]+)"
    },
    {
      "domains": [
        "tandt.posta.sk"
      ],
      "path": "^/(?:en/items|zasielky)/([^/?#]+)/?$"
    },
    {
      "domains": [
        "tandt.posta.sk"
      ],
      "pathPattern": "^/?$",
      "params": [
        "q"
      ]
    }
  ],
  "detection": [
    {
      "id": "slovenska-posta-own",
      "pattern": "^[CELR][A-Z]\\d{9}SK$",
      "confidence": "high",
      "checksum": "s10"
    },
    {
      "id": "slovenska-posta-s10",
      "pattern": "^[A-Z]{2}\\d{9}SK$",
      "confidence": "low",
      "preferred": true,
      "checksum": "s10"
    }
  ]
}
