{
  "id": "ontrac",
  "displayName": "OnTrac",
  "aliases": [
    "LaserShip"
  ],
  "region": {
    "countries": [
      "US"
    ]
  },
  "brand": {
    "color": "#cc2027"
  },
  "selectable": true,
  "timezone": "UTC",
  "tracking": {
    "mode": "automatic",
    "adapter": "ontrac",
    "steps": [
      "direct"
    ],
    "localClocks": true,
    "recognition": {
      "rank": 650
    }
  },
  "capabilities": [
    "history",
    "estimated_delivery",
    "weight",
    "dimensions",
    "canonical_tracking_number"
  ],
  "portal": {
    "url": "https://www.ontrac.com/tracking/?number={trackingNumber}",
    "searchUrl": "https://www.ontrac.com/tracking/",
    "helpUrl": "https://www.ontrac.com/support/",
    "canaryUrl": "https://www.ontrac.com/tracking/",
    "shows": [
      "status",
      "history",
      "estimated_delivery",
      "weight"
    ],
    "scraped": [
      "status",
      "history",
      "estimated_delivery",
      "weight",
      "dimensions"
    ],
    "discarded": [
      "recipient",
      "signature"
    ],
    "unavailable": []
  },
  "links": [
    {
      "domains": [
        "ontrac.com"
      ],
      "params": [
        "number"
      ]
    }
  ],
  "detection": [
    {
      "id": "ontrac-5",
      "pattern": "^(?:C1\\d|D10)\\d{12}$",
      "confidence": "high",
      "checksum": "ontrac"
    },
    {
      "id": "ontrac-1",
      "pattern": "^[CD]\\d{14}$",
      "confidence": "low",
      "checksum": "ontrac"
    },
    {
      "id": "ontrac-2",
      "pattern": "^L[AIEHNX]\\d{8}$",
      "confidence": "high"
    },
    {
      "id": "ontrac-3",
      "pattern": "^1LS\\d{12,14}$",
      "confidence": "high"
    },
    {
      "id": "ontrac-4",
      "pattern": "^1LS[A-Z0-9]{12,14}$",
      "confidence": "high"
    }
  ]
}
