{
  "id": "yto",
  "displayName": "YTO Express",
  "aliases": [],
  "region": {
    "countries": [
      "CN"
    ]
  },
  "brand": {
    "color": "#4d148c"
  },
  "selectable": true,
  "timezone": "Asia/Shanghai",
  "tracking": {
    "mode": "automatic",
    "adapter": "yto",
    "steps": [
      "direct",
      "retry"
    ],
    "localClocks": true
  },
  "capabilities": [
    "history",
    "location"
  ],
  "portal": {
    "url": "https://www.yto.net.cn/ytoExpress/waybill/search",
    "searchUrl": "https://www.yto.net.cn/ytoExpress/waybill/search",
    "helpUrl": "https://www.ytoglobal.com/rich/question/",
    "canaryUrl": "https://www.yto.net.cn/ytoExpress/waybill/search",
    "shows": [
      "status",
      "history",
      "location"
    ],
    "scraped": [
      "status",
      "history",
      "location"
    ],
    "discarded": [
      "contact_details",
      "recipient_details",
      "collection_addresses",
      "signature_images",
      "unlabelled_weight"
    ],
    "unavailable": [
      "eta",
      "pickup_point"
    ]
  },
  "links": [
    {
      "domains": [
        "yto.net.cn"
      ],
      "params": [
        "mailNo",
        "waybillNo"
      ]
    }
  ],
  "detection": [
    {
      "id": "yto-1",
      "pattern": "^D\\d{11}$",
      "confidence": "low"
    },
    {
      "id": "yto-2",
      "pattern": "^YT\\d{13}$",
      "confidence": "high"
    }
  ]
}
